SourceFile,PlazoPresentacionFecha,OrganismoConvocante,InformacionWeb,Presupuesto,Objeto,Score
20260109_Licitaciones.xlsx,2/9/2026,"RADIO TELEVISIÓN MADRID, S.A",contratos-publicos.comunidad.madrid/contrato-publico/contrato-servicios-retransmision-festejos-taurinos-2026,590907.91,"Contrato de Servicios para la Retransmisión de los Festejos Taurinos durante 2026 Contratación de los medios técnicos y profesionales necesarios para la retransmisión en HD, llave en mano de los eventos taurinos que se desarrollen dentro y fuera de la Comunidad de Madrid durante la temporada 2026 y que Radio Televisión Madrid seleccione para su programación",
20260109_Licitaciones.xlsx,1/26/2026,INSTITUTO PARA LA COMPETITIVIDAD EMPRESARIAL DE LA JUNTA DE CASTILLA Y LEÓN,contrataciondelestado.es/wps/poc?uri=deeplink:detalle_licitacion&idEvl=dqk1mc%2FIIz%2BopEMYCmrbmw%3D%3D,362407.62,"Diseño, decoración, montaje, desmontaje, mantenimiento, transporte y servicios asociados al stand del ICECYL en las ferias Sial Shanghái 2026, Vinexpo Asia 2026 y Thaifex 2026",
20260112_Licitaciones.xlsx,2/9/2026,"CONSEJO DE ADMINISTRACIÓN DE LA SOCIEDAD MERCANTIL ESTATAL PARA LA GESTIÓN DE LA INNOVACIÓN Y LAS TECNOLOGÍAS TURÍSTICAS, S.A.M.P. (SEGITTUR)",contrataciondelestado.es/wps/poc?uri=deeplink:detalle_licitacion&idEvl=7nj1F6GaYIuKeVWTb9Scog%3D%3D,175200,"Servicios de apoyo en la gestión de contenidos y diseño multimedia para el mantenimiento de las webs de Turespaña gestionadas por SEGITTUR: www.spain.info, www.visitspain.com.cn y www.tourspain.es, en todas sus versiones internacionales y subdominios. Las necesidades a satisfacer se especifican con mayor detalle en el “PLIEGO DE PRESCRIPCIONES TÉCNICAS QUE HA DE REGIR LA CONTRATACIÓN""",
20260112_Licitaciones.xlsx,2/9/2026,DIRECCIÓN DE COMPRAS DE LA CORPORACIÓN DE RADIO Y TELEVISIÓN ESPAÑOLA S.A,contrataciondelestado.es/wps/poc?uri=deeplink:detalle_licitacion&idEvl=ThKKt6HEvEXs%2BnLj3vAg5A%3D%3D,174344.58,Servicio de grabación y contenidos multimedia Jerusalén,
20260112_Licitaciones.xlsx,1/26/2026,DIRECCIÓN DE COMPRAS DE LA CORPORACIÓN DE RADIO Y TELEVISIÓN ESPAÑOLA S.A.,contrataciondelestado.es/wps/poc?uri=deeplink:detalle_licitacion&idEvl=8UKzMoFsySs2wEhQbcAqug%3D%3D,49930,Servicio de auxiliares de set - Cataluña y exteriores,
20260112_Licitaciones.xlsx,2/13/2026,AYUNTAMIENTO DE BARCELONA,contractaciopublica.cat/ca/detall-publicacio/cb75886b-c812-41db-8568-a191a9674f9d/300661904,301383.63,"Alquiler de material de infraestructura (estructuras no permanentes desmontables, tarimas, fondos de escenario, rampas, sillas, mesas, etc.), equipos de sonido, iluminación y audiovisuales, así como el transporte, montaje, operación, asistencia técnica y desmontaje de los mismos, para el desarrollo de actos y eventos organizados por el Departamento de Comunicación el Espacio Público, Gerencia de Área de Movilidad, Infraestructuras y Obras, y Gerencia de Área de Urbanismo y Vivienda (en adelante, Gerencias de SUMEP, MIO y UH), con medidas de contratación pública sostenible",
20260112_Licitaciones.xlsx,1/20/2026,MINISTERIO DE TRANSPORTES Y MOVILIDAD SOSTENIBLE. INECO-COMITÉ DE DIRECCIÓN,contrataciondelestado.es/wps/poc?uri=deeplink:detalle_licitacion&idEvl=j8Q5XV8l7Twtm4eBPtV6eQ%3D%3D,35000,"Servicio de diseño, montaje y desmontaje de stand en Passenger Terminal 2026",
20260112_Licitaciones.xlsx,1/24/2026,CONSELL COMARCAL DEL RIPOLLÈS (GIRONA),contractaciopublica.cat/ca/detall-publicacio/5b771eea-4718-4922-8d25-f24015065ad3/300660829,54090.68,"Es objeto de este contrato la prestación del servicio para la ejecución del programa operativo de marketing digital y acciones de comunicación 2026. Dado que el objeto del contrato es una de las actuaciones previstas del Plan de Sostenibilidad Turística del Ripollès, uno de los 19 PSTD del Plan Territorial de Sostenibilidad Turística en Destinos. obligado dar cumplimiento a la normativa ya las medidas previstas en el marco del PRTR y del MRR en la ejecución de las actuaciones",
20260112_Licitaciones.xlsx,1/26/2026,CONSORCI HOSPITALARI DE VIC,contractaciopublica.cat/ca/detall-publicacio/6908749c-ec99-4513-9874-7af1ca2a91f9/300657381,45000,"Servicio permanente de diseño, producción/impresión e instalación de elementos gráficos dirigidos a los usuarios y trabajadores de los distintos centros para que dispongan de toda la información necesaria para disfrutar de sus servicios y actividades. Lote 1 Servicio de diseño y adaptaciones gráficas de materiales de difusión y humanización. Lote 2 Servicio de impresión y producción de materiales de difusión y de humanización",
20260112_Licitaciones.xlsx,1/28/2026,MINISTERIO PARA LA TRANSICIÓN ECOLÓGICA Y EL RETO DEMOGRÁFICO. DIRECCIÓN GENERAL DEL INSTITUTO PARA LA DIVERSIFICACIÓN Y AHORRO DE LA ENERGÍA (IDAE),contrataciondelestado.es/wps/poc?uri=deeplink:detalle_licitacion&idEvl=ykQI5fyyOgkIYE3ZiZ%2BxmQ%3D%3D,60000,El objeto es la contratación de una empresa especializada en la organización y puesta en marcha de webinars para dar al IDAE un servicio de apoyo técnico para los webinars del IDAE,
20260112_Licitaciones.xlsx,1/28/2026,SECRETARÍA GENERAL DE LA FEDERACIÓN ESPAÑOLA DE MUNICIPIOS Y PROVINCIAS,contrataciondelestado.es/wps/poc?uri=deeplink:detalle_licitacion&idEvl=B4MiwSVSi3XgL1BHd3qjQA%3D%3D,42700,Contrato de servicios para la sistematización en formato audiovisual y difusión de buenas prácticas en la implementación de la Agenda 2030 en el ámbito local y en la elaboración de Informes Voluntarios Locales. Lote 1: Sistematización buenas prácticas en formato vídeo y en formato ficha PDF. Lote 2: Diseño y puesta en marcha de una campaña de comunicación y difusión. ,
20260112_Licitaciones.xlsx,1/24/2026,AYUNTAMIENTO DE ARENYS DE MAR (BARCELONA),contractaciopublica.cat/ca/detall-publicacio/b4b1e482-3231-447a-a9a0-774e70b6a2b8/300661765,18663.16,"Realización de un evento cultural relacionado con el mundo del libro y la literatura, con experiencias y actividades literarias para todos los públicos",
20260112_Licitaciones.xlsx,1/26/2026,JUNTA DE GOBIERNO DEL AYUNTAMIENTO DE ALCALÁ DE HENARES (MADRID),contrataciondelestado.es/wps/poc?uri=deeplink:detalle_licitacion&idEvl=A5Min4R3mzk36J9Lctlsuw%3D%3D,18176.5,Contrato mixto del servicio de un festival de comic e ilustración en la Ciudad de Alcalá de Henares,
20260112_Licitaciones.xlsx,1/26/2026,DIRECCIÓN DE COMPRAS DE LA CORPORACIÓN DE RADIO Y TELEVISIÓN ESPAÑOLA S.A.,contrataciondelestado.es/wps/poc?uri=deeplink:detalle_licitacion&idEvl=Tfwsc3IFwO4l5NjlNci%2BtA%3D%3D,23100,Posicionamiento en buscadores y aplicaciones SEO y ASO,
20260112_Licitaciones.xlsx,1/16/2026,INSTITUTO DE CULTURA DE BARCELONA,licitacions.bcn.cat/licitacion/licitaciones/detalle?id=14329068,11227.1,"Diseño y producción de productos gráficos (en papel y digital) de la programación de las 
actividades del Museu Frederic Marès y de elementos de señalética del edificio.",
20260112_Licitaciones.xlsx,1/15/2026,AYUNTAMIENTO DE CASTELLDEFELS (BARCELONA). COMUNICACIÓN E IMAGEN,contractaciopublica.cat/es/detall-publicacio/300661185,14999,"Servicio de grabación de eventos municipales en vídeo y edición de estos vídeos para las redes sociales (formato vertical), pantallas digitales (formato horizontal) y webs del Ayuntamiento de Castelldefels para el año 2026",
20260112_Licitaciones.xlsx,,JUNTA DIRECTIVA DE LA ASOCIACIÓN CLUB DE PRODUCTO CICLOTURISMO EN MADRID,contrataciondelestado.es/wps/poc?uri=deeplink:detalle_licitacion&idEvl=DG%2Fnpb1ec0aHCIsjvJ3rhQ%3D%3D,7438.02,"Prestación de servicios de gerencia y gestión para la Asociación Club de Producto Cicloturismo en Madrid, incluyendo apoyo administrativo, comunicación interna y externa, supervisión de contratos de marketing y coordinación operativa de la asociación",
20260112_Licitaciones.xlsx,1/16/2026,JUNTA DIRECTIVA DE LA ASOCIACIÓN CLUB DE PRODUCTO CICLOTURISMO EN MADRID,contrataciondelestado.es/wps/poc?uri=deeplink:detalle_licitacion&idEvl=x1VbPWIddhbua%2Fi14w%2FPLA%3D%3D,31157.55,"Con el fin de profesionalizar su gestión y asegurar el cumplimiento de sus acciones y plazos, se contrata un servicio de apoyo técnico que permita mejorar la gestión interna, impulsar las iniciativas decididas y garantizar el cumplimiento de los acuerdos de sus órganos de gobierno, contribuyendo al logro de sus objetivos",
20260112_Licitaciones.xlsx,1/16/2026,AYUNTAMIENTO DE LAS ROZAS DE MADRID (MADRID),,,"Ocupación en el Recinto Ferial, del 5 al 8 de febrero, (montaje los días 2, 3 y 4 y desmontaje el 9 y 10 de febrero) para la realización del evento: “The Champions Cheescake”.",
20260112_Licitaciones.xlsx,1/16/2026,AYUNTAMIENTO DE LAS ROZAS DE MADRID (MADRID),,,"Otorgamiento de autorización demanial en el Centro Multiusos de Las Rozas, del día 12 al 22 de marzo de 2026 (montaje los días 9. 10 y 11 y desmontaje el 22 y 23 de marzo) con el objeto de realizar el evento gastronómico “Chifa Nikkei Fest”.",
20260113_Licitaciones.xlsx,1/29/2026,MINISTERIO DE VIVIENDA Y AGENDA URBANA,contrataciondelestado.es/wps/poc?uri=deeplink:detalle_licitacion&idEvl=ASxOy%2F72o1eFlFRHfEzEaw%3D%3D,99065.07,Pas - Servicio De Producción Y Realización De Eventos Públicos Institucionales Con Cobertura Informativa Promovidos Por El Ministerio De Vivienda Y Agenda Urbana. 2026,
20260113_Licitaciones.xlsx,1/27/2026,PRESIDENCIA DE LA MANCOMUNIDAD INTERMUNICIPAL DE SERVICIOS SOCIALES DEL ESTE DE MADRID (MISSEM),contrataciondelestado.es/wps/poc?uri=deeplink:detalle_licitacion&idEvl=zAu4Yzjyq4V9PLkba5eRog%3D%3D,2450,"Servicio de videoactas, grabación y retransmisión en streaming de las sesiones del Pleno y Comisiones Informnativas de la Mancomunidad Intermunicipal de Servicios sociales del Este de Madrid, (MISSEM)",
20260113_Licitaciones.xlsx,1/30/2026,AGÈNCIA DE RESIDUS DE CATALUNYA,contractaciopublica.cat/ca/detall-publicacio/d64e94cb-e879-4f10-820e-34d77d5e4520/300661930,93100,"Contratación de los servicios de asistencia técnica para la comunicación corporativa de 2026, es decir el desarrollo y mantenimiento de la página web (www.medwaves-centre.org), el diseño y maquetación de diferentes materiales de comunicación, la gestión y edición de las redes sociales así como el asesoramiento de la estrategia de comunicación por las campañas del Centro. Lote 1 Creación, desarrollo y mantenimiento de páginas web para MedWaves. Lote 2 Diseño, maquetación de contenidos visuales y otros materiales de comunicación y marketing. Lote 3 Gestión de redes sociales, análisis de marketing y gestión de herramientas online por el MedWaves. Lote 4 Gestión de campañas: desarrollo de un plan de estrategia de campañas, de creación de contenidos e implementación de la estrategia de actuación.",
20260113_Licitaciones.xlsx,2/11/2026,CONSORCI DE PROMOCIÓ ENOTURÍSTICA DEL TERRITORI DO ALELLA,contractaciopublica.cat/ca/detall-publicacio/d16b57f0-4978-48fe-bd52-ab1e010a15f5/300661305,140495.87,Servicios de apoyo a la promoción del territorio DO Alella y de los servicios complementarios de promoción de los entes adheridos al Consorcio de Promoción Enoturística del Territorio DO Alella,
20260113_Licitaciones.xlsx,1/28/2026,"MINISTERIO DE HACIENDA. PRESIDENCIA EJECUTIVA DE LA AGENCIA E.F.E. S.A.U., S.M.E.",contrataciondelestado.es/wps/poc?uri=deeplink:detalle_licitacion&idEvl=4uaVKXeL8jrI8aL3PRS10Q%3D%3D,58384,"Diseño, ingeniería y dirección de obra del sistema de distribución de contenidos de tv sobre IP",
20260113_Licitaciones.xlsx,1/21/2026,"FMCEYUP - FUNDACIÓN MUNICIPAL DE CULTURA, EDUCACIÓN Y UNIVERSIDAD POPULAR DE GIJÓN",community.vortal.biz/public/?currentLanguage=es,12000,"Feten 2026 - servicio de alquiler, transporte, montaje y desmontaje de gradas y sillas para los espacios escenicos de la feria",
20260113_Licitaciones.xlsx,1/19/2026,AYUNTAMIENTO DE TARRAGONA. DEPARTAMENTO DE CULTURA,contractaciopublica.cat/es/detall-publicacio/300662972,14985,Servicio de comunicación y gestión de las redes sociales del Centro de Arte Contemporáneo de Tarragona,
20260113_Licitaciones.xlsx,,"DIRECCIÓN GENERAL DE RADIOTELEVISIÓN DEL PRINCIPADO DE ASTURIAS, S.A. UNIPERSONAL",contrataciondelestado.es/wps/poc?uri=deeplink:detalle_licitacion&idEvl=wxOS%2BzKfx%2Fxq1DdmE7eaXg%3D%3D,1477449.75,Servicio de unidad móvil y su operación para RTPA,
20260113_Licitaciones.xlsx,2/2/2026,DIRECCIÓN GERENCIA DE LA FUNDACIÓN JÓVENES Y DEPORTE,contrataciondelestado.es/wps/poc?uri=deeplink:detalle_licitacion&idEvl=N2mRiPN79y9rhBlEHQFSKA%3D%3D,14049.59,Patrocinio publicitario de la imagen de la FJyD y de Marca Extremadura a través del Kazajoz Cycling Team en su participación en el Campeonato de España XCO durante el año 2026,
20260113_Licitaciones.xlsx,2/2/2026,DIRECCIÓN GERENCIA DE LA FUNDACIÓN JÓVENES Y DEPORTE,contrataciondelestado.es/wps/poc?uri=deeplink:detalle_licitacion&idEvl=57M9BGJBB6e7JOCXkOhcDg%3D%3D,107438.02,Patrocinio publicitario de la imagen de la FJyD y de Marca Extremadura en la prueba “Vuelta Ciclista a Extremadura féminas” del año 2026,
20260113_Licitaciones.xlsx,2/16/2026,"CONSEJERO DELEGADO DE INGENIERÍA DE SISTEMAS PARA LA DEFENSA DE ESPAÑA S.A., S.M.E. Y M.P",contrataciondelestado.es/wps/poc?uri=deeplink:detalle_licitacion&idEvl=uwgiwx2tqEkXhk1FZxEyvw%3D%3D,102877.5,Contratación de un servicio de apoyo en el área de esquema nacional de seguridad a la sección de sistemas de información y telecomunicaciones (cis) j6 del cuartel general de la UME,
20260113_Licitaciones.xlsx,1/26/2026,AXENCIA GALEGA DA CALIDADE ALIMENTARIA,www.contratosdegalicia.gal/consultaOrganismo.jsp?lang=gl&ID=800&N=66&OR=66&SORT=2&ORDER=2,,"Servicio de asistencia en ferias. Servicio de diseño, organización, montaje, desmontaje y atención de los puestos de la Agencia Gallega de la Calidad Alimentaria en las ferias Prowein, Alimentaria y Salón Gourmets durante el 2026.",
20260113_Licitaciones.xlsx,1/15/2026,"DEPARTAMENTO DE AGRICULTURA, GANADERÍA, PESCA Y ALIMENTACIÓN DE LA GENERALIDAD DE CATALUÑA",contractaciopublica.cat/ca/perfils-contractant/detall/202191?categoria=0,643720.75,"Organización, realización y comunicación de la campaña de sensibilización para prevenir y reducir pérdidas y el desperdicio alimentario. Lote 1 Coordinación y ejecución de la comunicación de la campaña. Lote 2 Organización Gastrorecup. Lote 3 Organización Gran Comida de Aprovechamiento",
20260113_Licitaciones.xlsx,2/11/2026,"FERROCARRIL METROPOLITA DE BARCELONA, SA",contractaciopublica.gencat.cat/perfil/FMB,,"Servicio para la gestión, ejecución y optimización del programa de marqueting de afiliación para los productos Hola Barcelona",
20260114_Licitaciones.xlsx,2/12/2026,INSTITUTO BARCELONA DEPORTES. AYUNTAMIENTO DE BARCELONA.,contractaciopublica.cat/ca/detall-publicacio/3e6753c8-7027-4f1e-a40d-fd0161f2f369/300659367,490773.21,"Diseño, organización, producción y dirección de la Gala de presentación oficial de los equipos del Grand Départ Barcelona 2026",
20260114_Licitaciones.xlsx,1/28/2026,AYUNTAMIENTO DE MADRID. DISTRITO DE SALAMANCA,contrataciondelestado.es/wps/poc?uri=deeplink:detalle_licitacion&idEvl=jTizJx%2FTxZDIGlsa0Wad%2Bw%3D%3D,194560.36,"Contrato de servicios de: organización, programación y ejecución de actividades socioculturales, artísticas y lúdicas del Distrito de Salamanca para los años 2026 a 2028",
20260114_Licitaciones.xlsx,1/16/2026,INSTITUTO CATALÁN DE LAS EMPRESAS CULTURALES,contractaciopublica.cat/ca/detall-publicacio/4f952dea-9782-4edf-9a0b-a17d90fc73a1/300664590,991.74,Servicio de inserción de publicidad institucional en ICAT para la difusión de la participación catalana en el festival ESNS 2026 (Eurosonic Noorderslag),
20260114_Licitaciones.xlsx,1/27/2026,CONSORCI CATALUNYA INTERNACIONAL,contractaciopublica.cat/ca/detall-publicacio/469d5e94-bef6-42e3-bef3-e2ad9a23ef47/300663601,33057.85,"Actualización de contenidos, producción, montaje y desmontaje de la exposición itinerante ""Europa, nuestro espacio común""",
20260114_Licitaciones.xlsx,2/2/2026,MINISTERIO DE CULTURA. SECRETARÍA DE ESTADO DE CULTURA. DIRECCIÓN GENERAL DE PATRIMONIO CULTURAL Y BELLAS ARTES,contrataciondelestado.es/wps/poc?uri=deeplink:detalle_licitacion&idEvl=YsAx7qNdoxdq1DdmE7eaXg%3D%3D,59269.56,"Servicio de producción, montaje y desmontaje de la exposición temporal ""Bateas Novohispanas. Una encrucijada cultural"" en el Museo de América",
20260114_Licitaciones.xlsx,1/28/2026,AGENCIA GALLEGA DE LA CALIDAD ALIMENTARIA,www.contratosdegalicia.gal/licitacion?N=827174,890772.95,"AGA-2026-0002: Servicio de diseño, organización, montaje, desmontaje y atención de los puestos de la Agencia Gallega de la Calidad Alimentaria en las ferias Prowein, Alimentaria y Salón Gourmets durante lo 2026",
20260114_Licitaciones.xlsx,1/28/2026,"PRINCIPADO DE ASTURIAS. CONSEJERÍA DE CULTURA, POLÍTICA LLINGÜÍSTICA Y DEPORTE",contrataciondelestado.es/wps/poc?uri=deeplink:detalle_licitacion&idEvl=lWXIcGplYquKeVWTb9Scog%3D%3D,30750.02,"Servicio de coedición y comercialización de las obras ganadoras de los Premios Literarios en lengua asturiana convocados por la Consejería de Cultura, Política Llingüística y Deporte del Principado de Asturias en 2025. Lote 1: Obra Bisarma, de Marina Pangua Cuesta, ganadora del XLVI Premio Xosefa Xovellanos de Novela en lengua asturiana. Lote 2: Obra Esti amor asturfalante, de Sofía Fernández Castañón, ganadora del XXXI Premio Xuan María Acebal de Poesía en lengua asturiana. Lote 3: Obra Al verde de El Cierru, de Iris Díaz Trancho, ganadora del XXXI Premio Máximo Fuertes Acevedo de Ensayo en lengua asturiana. Lote 4: Obra Ascensoristes, S.A., de María Ángeles García Rodríguez y Xurde Fernández Fernández, ganadora del XVIII Premio María Josefa Canellada de Literatura infantil y juvenil en lengua asturiana. Lote 5: Obra Mil Venecies, de Agustín Cernuda del Río y Alejandro Castrillo Cernuda, ganadora del XVII Premio Alfonso Iglesias de Cómic en lengua asturiana. Lote 6: Obra Diariu indecente de una docente, de Claudia Gutiérrez Lueje, ganadora del V Premio Enriqueta González Rubín de Narrativa Joven. Lote 7: Obra Sobrante d¿un foriatu recortable primero de les venti cero nueve, de Milio Ureta Soto, ganadora del III Premio Pachín de Melás de Textos Teatrales.",
20260114_Licitaciones.xlsx,1/28/2026,AYUNTAMIENTO DE SITGES (BARCELONA),,,"Permiso para la ocupación del dominio público 
por la celebración de un evento de Patchwork.",
20260114_Licitaciones.xlsx,1/18/2026,JUNTA DE GOBIERNO DEL AYUNTAMIENTO DE MÓSTOLES (MADRID),contrataciondelestado.es/wps/poc?uri=deeplink:detalle_licitacion&idEvl=XGTiX61PSbDIGlsa0Wad%2Bw%3D%3D,14999,"El presente contrato tiene por objeto la planificación, organización y ejecución del evento ""CONFETI FEST"", que se llevará a cabo el día 15 de febrero de 2026 en Móstoles",
20260114_Licitaciones.xlsx,1/18/2026,JUNTA DE GOBIERNO DEL AYUNTAMIENTO DE MÓSTOLES (MADRID),contrataciondelestado.es/wps/poc?uri=deeplink:detalle_licitacion&idEvl=Gt3nLBdB4j1t5r0ngvMetA%3D%3D,14999,Contrato para la organización del Baile Familiar de Carnaval y Concurso de Disfraces en las Fiestas de Carnaval 2026 Ayuntamiento de Móstoles,
20260114_Licitaciones.xlsx,1/14/2026,"AYUNTAMIENTO DE MADRID. ÁREA DE GOBIERNO DE CULTURA, TURISMO Y DEPORTE",contrataciondelestado.es/wps/poc?uri=deeplink:detalle_licitacion&idEvl=NpyB%2BhYfb2w2wEhQbcAqug%3D%3D,11500,"Contrato menor de servicios de creación, edición e impresión de libro ilustrado para la difusión de la Semana Santa de Madrid",
20260114_Licitaciones.xlsx,1/19/2026,JUNTA DE GOBIERNO DEL AYUNTAMIENTO DE ALCORCÓN (MADRID),contrataciondelestado.es/wps/poc?uri=deeplink:detalle_licitacion&idEvl=kSDvlN5lb1w7u6%2B%2FR7DUoA%3D%3D,14000,Servicios de difusión y comunicación del proceso de presupuestos participativos,
20260114_Licitaciones.xlsx,1/21/2026,DIRECCIÓN DE COMPRAS DE LA CORPORACIÓN DE RADIO Y TELEVISIÓN ESPAÑOLA S.A,contrataciondelestado.es/wps/poc?uri=deeplink:detalle_licitacion&idEvl=%2FQvM9nnhSkiFQ%2FlhRK79lA%3D%3D,10500,Sistema de sincronismo y distribución para Estudios de RNE,
20260114_Licitaciones.xlsx,1/28/2026,"MINISTERIO DE DERECHOS SOCIALES, CONSUMO Y AGENDA 2030. DIRECCIÓN GENERAL DEL INSTITUTO DE MAYORES Y SERVICIOS SOCIALES",contrataciondelestado.es/wps/poc?uri=deeplink:detalle_licitacion&idEvl=KRsU6i9mLa2Izo3LHNPGcQ%3D%3D,808588.65,"Servicios de soporte para la gestión de redes, comunicaciones y seguridad para el Instituto de Mayores y Servicios Sociales (IMSERSO)",
20260114_Licitaciones.xlsx,2/16/2026,"MINISTERIO DE DEFENSA. CONSEJERO DELEGADO DE INGENIERÍA DE SISTEMAS PARA LA DEFENSA DE ESPAÑA S.A., S.M.E. Y M.P.",contrataciondelestado.es/wps/poc?uri=deeplink:detalle_licitacion&idEvl=rRBRLOzOjSK7JOCXkOhcDg%3D%3D,96000,Servicios de consultoría tecnológica de inteligencia de negocio en el ámbito del seguimiento del Plan Industrial y Tecnológico de Seguridad y Defensa (PITSD),
20260114_Licitaciones.xlsx,2/17/2026,"MADRID DESTINO CULTURA TURISMO Y NEGOCIO, S.A.",contrataciondelestado.es/wps/poc?uri=deeplink:detalle_licitacion&idEvl=4hsMhBtXY%2BngL1BHd3qjQA%3D%3D,148392.52,"Contratación de la prestación de los servicios de coordinación y trabajo de comunicación, atención a medios y redes sociales de campañas culturales (Lotes 1, 2, 3, 4 y 5) que son encomendadas a Madrid Destino. Lote 1: Navidad y Cabalgata de Reyes, San Isidro y Carnaval. Lote 2: Veranos de la Villa y Refúgiate en la Cultura, Semana Santa y Año Nuevo Chino. Lote 3: Festival Internacional JAZZMADRID. Lote 4: Bienal Flamenco Madrid. Lote 5: Campañas culturales nuevas: medio mes y mes entero.",
20260114_Licitaciones.xlsx,1/30/2026,MINISTERIO DEL INTERIOR. JEFATURA DE ASUNTOS ECONÓMICOS DE LA GUARDIA CIVIL,contrataciondelestado.es/wps/poc?uri=deeplink:detalle_licitacion&idEvl=iprMePqHC9%2BHCIsjvJ3rhQ%3D%3D,67146,"Contratación del servicio de impresión, empaquetado, transporte y entrega de credenciales de condecoraciones, diplomas de reconocimiento a personal retirado, Reales Despachos y Títulos de Empleo (CDRDTE), emitidos periódicamente, tanto de carácter ordinario como honorifico, por la Guardia Civil",
20260115_Licitaciones.xlsx,1/29/2026,"MADRID DESTINO CULTURA TURISMO Y NEGOCIO, S.A.",contrataciondelestado.es/wps/poc?uri=deeplink:detalle_licitacion&idEvl=xgVySKwqSH7jHF5qKI4aaw%3D%3D,41000,Contratación del montaje y desmontaje de la exposición pelo de tormenta. Homenaje a Francisco Nieva,
20260115_Licitaciones.xlsx,2/12/2026,INSTITUTO DE CULTURA DE BARCELONA,contractaciopublica.cat/ca/detall-publicacio/afa59841-4e39-4803-a13e-20e4e4118bab/300664962,1337849.96,"El objeto del contrato es la conceptualización, diseño, comunicación y gestión integral del servicio “Incentiu Cultural” del Instituto de Cultura del Ayuntamiento de Barcelona",
20260115_Licitaciones.xlsx,2/3/2026,"MINISTERIO DE EDUCACIÓN, FORMACIÓN PROFESIONAL Y DEPORTES. PRESIDENCIA DEL CONSEJO SUPERIOR DE DEPORTES",contrataciondelestado.es/wps/poc?uri=deeplink:detalle_licitacion&idEvl=VhZtW8%2FlXR3pxJFXpLZ%2B2A%3D%3D,220651.24,Servicio de producción gráfica y audiovisual para el Consejo Superior de Deportes,
20260115_Licitaciones.xlsx,1/21/2026,SERVICIO DE SALUD DEL PRINCIPADO DE ASTURIAS (SESPA),community.vortal.biz/public/?currentLanguage=es,825,CCompras_Servicio de diseño gráfico (diagr amación) y maquetación de un documento de ayuda para mujeres invitadas en el programa de cribado poblacional del cáncer de cérvix del Principado de Asturias con instrucciones para el uso de autótoma del Servicio de Salud del Principado de Asturias (contrato menor).,
20260115_Licitaciones.xlsx,1/16/2026,FUNDACIÓN PARA LA INVESTIGACIÓN BIOMÉDICA DEL HOSPITAL DE LA PAZ,community.vortal.biz/public/?currentLanguage=es,38000,Produccion de ejemplares y puesta a disposición para su compra en librerías y plataformas de venta online,
20260115_Licitaciones.xlsx,,CENTRO DE CULTURA CONTEMPORÁNEA DE BARCELONA CCCB. ,contractaciopublica.cat/es/detall-publicacio/300666529,550000,Servicio de producción de las actividades del Centro de Cultura Contemporánea de Barcelona (CCCB),
20260115_Licitaciones.xlsx,,CENTRO DE CULTURA CONTEMPORÁNEA DE BARCELONA CCCB.,contractaciopublica.cat/es/detall-publicacio/300665947,900000,Servicio de dirección técnica y concejalía de las actividades que se presentan en el Centro de Cultura Contemporánea de Barcelona (CCCB),
20260115_Licitaciones.xlsx,2/13/2026,INSTITUTO DE TURISMO DE ESPAÑA (TURESPAÑA),contrataciondelestado.es/wps/poc?uri=deeplink:detalle_licitacion&idEvl=KKusH8NMtLN9PLkba5eRog%3D%3D,409091.8,"Contratación por procedimiento abierto conforme al artículo 156 al 158 de la LCSP, de un servicio de celebración de unas jornadas inversas de apoyo a la comercialización de la oferta turística española para el mercado latinoamericano",
20260115_Licitaciones.xlsx,2/16/2026,INSTITUTO DE TURISMO DE ESPAÑA (TURESPAÑA),contrataciondelestado.es/wps/poc?uri=deeplink:detalle_licitacion&idEvl=hyhxvg5z7B1LAIVZdUs8KA%3D%3D,302120.06,"El objeto del contrato son los servicios de organización y desarrollo de las jornadas inversas del mercado europeo que tendrán lugar los días 14 a 18 de septiembre de 2026 en Pamplona, así como la coordinación de las actividades relacionadas con el mismo, en los términos establecidos en el pliego de prescripciones técnicas",
20260115_Licitaciones.xlsx,1/29/2026,JUNTA DE EXTREMADURA. CONSEJERÍA DE GESTIÓN FORESTAL Y MUNDO RURAL,contrataciondelestado.es/wps/poc?uri=deeplink:detalle_licitacion&idEvl=vY%2B3AzVXZ8d6nTs9LZ9RhQ%3D%3D,37718.72,"SERCPA25127: Servicio para la construcción en régimen de alquiler, transporte, montaje, desmontaje, mantenimiento y servicios complementarios del stand de la Consejería de Gestión Forestal y Mundo Rural de la Junta de Extremadura para la participación en Feria Cinegética 2026",
